"字段1","字段2","字段3","字段4"
"【成都】2019周深“C-929星球”巡回演唱会","时间：2019.12.14 周六 19:30","场馆：成都市 | 华熙LIVE·528M空间","<div class=""detail"" data-spm=""detail-info"" data-v-df34eb04=""""><div class=""list"" id=""detail""><div class=""title"">演出介绍</div> <div class=""words""><p><p></p><p><img src=""//img.alicdn.com/imgextra/i4/2251059038/O1CN01qMF73j2GdSCvV3HK5_!!2251059038.jpg_q60.jpg"" height=""406"" width=""600""></p><p>一颗银河之外的星球</p><p>一方直面内心的世界</p><p>一次寻觅与治愈的旅途</p><p>一次关于音乐的独白</p><p>C-929！</p><p>C — 周深的英文名Charlie的开头字母</p><p>9.29 — 周深的生日</p><p></p><p><img src=""//img.alicdn.com/imgextra/i2/2251059038/O1CN01tf51PR2GdSD4Dg21x_!!2251059038.jpg_q60.jpg"" height=""394"" width=""600""></p><p>这是一颗属于周深的星球</p><p>一颗你在任何书籍中都查找不到的星球</p><p>闭上眼睛</p><p>跟着周深的歌声漂流 逃离纷乱世事</p><p></p><p>让大人的面具睡去</p><p>让内心的孩子苏醒</p><p>周深化身C-929星球的小王子，带领大家在梦中降落C-929星球，在星球中寻找、遇见、得到、释怀。在梦中，遇见骄傲的玫瑰，睿智的狐狸，迷惑的飞行员，寻找勇气与爱，回归最简单的自己。</p><p>闭上眼睛，逃离纷乱世事，让大人的面具睡去， 让孩子的内心苏醒， 在周深的歌声中，让浮躁的心渐渐安静，让纷乱的呼吸渐渐平复。 沉入梦中，在无边宇宙中漂流，飞向C-929星球。</p><p></p><p><img src=""//img.alicdn.com/imgextra/i3/2251059038/O1CN01DlqF5P2GdSCvV4Hnf_!!2251059038.jpg_q60.jpg"" height=""376"" width=""600""></p><p>在 C-929 星球中和周深小王子一起寻找、遇见、寻找美丽却带刺的玫瑰，寻找孤独危险的蛇，寻找迷茫因惑的飞行员，在百味交杂中，体验和感悟，内心的孩子渐渐苏醒，回归。</p><p></p><p><img src=""//img.alicdn.com/imgextra/i2/2251059038/O1CN011Vf8z72GdSD50jtbY_!!2251059038.jpg_q60.jpg"" height=""365"" width=""600""></p><p></p><p>我们终将长大，却不一定非要复杂 涤荡净内心的杂念，回归最纯粹的自己 每个大人，真实都是发光的小孩 愿我们历经千帆，归来仍是少年。</p><p></p><p></p></p></div></div> <div class=""list"" id=""notice0""><div class=""title"">购票须知</div> <div class=""words""><div><p class=""item_title"">我最多可以购买几张？</p> <ul><li>本项目不同场次将对应不同的限购政策，每笔订单最多购买6张，每个账号最多购买6张；如您需购买的量级超出单笔订单限额，请您分多单购买</li></ul></div><div><p class=""item_title"">需要实名购买吗？</p> <ul><li>本项目无需实名制购票，购买时不需要选择观演人</li></ul></div><div><p class=""item_title"">下单成功后，是否允许修改配送信息？</p> <ul><li>本项目不支持修改配送地址，请务必在下单前检查好您的收货地址</li></ul></div><div><p class=""item_title"">婴幼儿及儿童需要买票吗？</p> <ul><li>一人一票，儿童需购买全价票入场</li></ul></div><div><p class=""item_title"">我的座位怎么安排？/现场入座要求是什么？</p> <ul><li>本项目不支持自主选座购票，所有订单将按付款的先后顺序，从相应票档的剩余可选座位中优先连坐配票。入场时请按照门票座位信息对号入座</li></ul></div><div><p class=""item_title"">我要怎么开发票？</p> <ul><li>如需发票，请您在演出开始前通过订单页补开，发票将在演出结束后1个月左右，统一由开具方提供</li></ul></div><div><p class=""item_title"">我购买后是否可以退换票？</p> <ul><li>票品为有价证券，非普通商品，其背后承载的文化服务具有时效性、稀缺性等特征，不支持退换。如您购票后无法正常观看，还请自行处理</li></ul></div><div><p class=""item_title"">演出时长</p> <ul><li>演出时长约90分钟（以现场为准）</li></ul></div><div><p class=""item_title"">异常行为说明</p> <ul><li>对于异常订购行为，大麦网有权在订单成立或者生效之后取消相应订单。异常订购行为包括但不限于以下情形： （1）通过同一ID订购超出限购张数的订单； （2）经合理判断认为非真实消费者的下单行为，如：使用机器人软件、蜘蛛软件、爬虫软件或人工众包方式刷票等。（3）通过批量相同或虚构的支付账号、收货地址（包括下单时填写及最终实际收货地址）、收件人、电话号码订购超出限购张数的订单等</li></ul></div></div></div><div class=""list"" id=""notice1""><div class=""title"">观演须知</div> <div class=""words""><div><p class=""item_title"">入场时间</p> <ul><li>演出前约30分钟</li></ul></div><div><p class=""item_title"">禁止携带物品</p> <ul><li>由于安保和版权的原因，大多数演出、展览及比赛场所禁止携带食品、饮料、专业摄录设备、打火机等物品，请您注意现场工作人员和广播的提示，予以配合</li></ul></div><div><p class=""item_title"">寄存说明</p> <ul><li>无寄存处，请自行保管携带物品</li></ul></div><div><p class=""item_title"">主要演员（团体）</p> <ul><li>周深</li></ul></div><div><p class=""item_title"">最低演出时长</p> <ul><li>90</li></ul></div><div><p class=""item_title"">大麦网初始开售时全场可售门票总张数</p> <ul><li>2000</li></ul></div></div></div></div>"
"【成都】奥地利维也纳施特劳斯家族爱乐乐团2020新年音乐会","时间：2020.01.04-01.05","场馆：成都市 | 四川大剧院 大剧场","<div class=""detail"" data-spm=""detail-info"" data-v-df34eb04=""""><div class=""list"" id=""detail""><div class=""title"">演出介绍</div> <div class=""words""><p><p>购票须知</p><p>特别提示</p><p>根据《网络交易管理办法》中关于：“其他根据商品性质并经消费者在购买时确认不宜退货的商品，不适用无理由退货。”的规定，鉴于文体演出票品特殊性，演出门票为联网售票，门票和座位都是唯一的，具有时效性、唯一性、数字化等特殊属性，一旦票品售出，不支持退换，请您在购买时务必仔细核对您的订单信息并审慎下单。（因不可抗力因素导致演出取消或延期除外）。</p><p>如何取票</p><p>正式开票后，请到本剧目所在演出场馆（四川大剧院）自助取票机，凭下单取票码/二维码/身份证取票。</p><p>工作日取票：周一至周五9：00-17 : 00</p><p>演出当晚取票：演出前30分钟</p><p><br>取票地址：四川大剧院（成都市青羊区人民中路1号附2号）。（天府广场，地铁1、2线天府广场站F出口）</p><p>本剧院暂不支持停车，建议乘坐公共交通前往,给您带来的不便，敬请谅解！</p><p>（注：1、选择取票码的观众，必须要使用下单手机上发送的取票码，否则将无法取票和不能入场观看，后果自负）</p><p>2、选择二维码取票的观众，必须要使用下单手机二维码取票，否则将无法取票和不能入场观看，后果自负）</p><p>3、选择身份证取票的观众，取票一定要用带上并使用下单身份证取票，否则将无法取票和不能入场观看，后果自负）</p><p>配送说明</p><p>系统暂不支持配送，请到本剧目所在演出场馆（四川大剧院）自助取票机，凭下单取票码/二维码/身份证取票。</p><p>购票咨询</p><p>四川大剧院（锦城艺术宫）统一订票电话热线：<strong>028-86650834&nbsp;</strong>（周一至周五9：00-17 : 00）</p><p><strong>圣地之声·奏响百年</strong></p><p><strong>奥地利维也纳施特劳斯家族爱乐乐</strong><strong>团</strong></p><p><strong>VIENNA AUSTRIA</strong></p><p><strong>​STRAUSS LEGACY PHILHARMONY ORCHESTRA</strong></p><p><strong>2020</strong><strong>新年音乐会</strong></p><p><strong>NEW YEAR'S CONCERT</strong></p><p>&nbsp;</p><p>仪式感代表着在生活中对某个重要阶段的敬畏</p><p>或者是即将开启某个重要时刻</p><p>一年365天，生活让我们充实而忙碌</p><p>前进的脚步从未停歇</p><p>为了迎接新的一年</p><p>在2019-2020跨年之际，带上家人享受一场新年音乐会</p><p>开启一段全新的旅程</p><p><img src=""//img.alicdn.com/imgextra/i2/2251059038/O1CN01A2Rg0h2GdSD4JG4GT_!!2251059038.png_q60.jpg""></p><p>奥地利——一个从古至今的音乐圣地，其首都维也纳更是全球赫赫有名的“音乐之都”，创作出“旷世之作”的贝多芬、莫扎特、海顿、施特劳斯家族等音乐家均出自此地</p><p>施特劳斯家族——一个传奇的古典乐天才家族，老约翰·施特劳斯被人们称为“圆舞曲之父”</p><p>奥地利维也纳施特劳斯家族爱乐乐团——一个全世界乐迷都由衷钦慕的专业交响乐团</p><p><img src=""//img.alicdn.com/imgextra/i1/2251059038/O1CN01mxQtdm2GdSD2lPn10_!!2251059038.png_q60.jpg""></p><p><strong>爱乐家族 荣耀出巡</strong></p><p>奥地利维也纳斯特劳斯家族爱乐乐团成立于1843年，是一只近百名的专业音乐精英组成的杰出交响乐团，具有辉煌的演出经历，并享有国际盛誉。最初乐团的成立是为了纪念和传承奥地利伟大的作曲家施特劳斯家族的音乐遗产。施特劳斯家族是19世纪奥地利维也纳著名的音乐世家，主要是指约翰·施特劳斯父子，即父亲老约翰·施特劳斯和他的三个儿子——小约翰·施特劳斯、约瑟夫·施特劳斯和爱德华·施特劳斯。奥地利维也纳斯特劳斯家族爱乐乐团在从维也纳乃至全球的上千场辉煌巡演中，一直坚守职责为施特劳斯家族服务。将高水平的演出带给广大民众，让更多人接触到古典音乐。</p><p>和传统意义上的交响乐团不同，乐团不但能演奏古典、传统的音乐作品，而且对激进的现代作品也有独到的解释，满足当代观众对音乐会的观赏要求。乐团非常重视和其他国家的文化、音乐交流。和欧盟国家的音乐团体有着良好的合作关系，乐团拥有自己的独奏家，举办音乐大师班，将沉闷在象牙塔里的古典音乐，以自己特有的活泼形式介绍给大众，此外，乐团还举办慈善募捐义演，展示了人类美好的精神世界。</p><p>在2007至2017年间，该团多次来到中国进行巡回演出，在北京人民大会堂、中山音乐堂、上海大剧院、上海东方艺术中心、重庆大剧院、福州大剧院、哈尔滨音乐厅、温州大剧院、常州大剧院等知名场馆内做演奏，所到之处均受到当地观众的喜爱与各地媒体的盛赞。</p><p><img src=""//img.alicdn.com/imgextra/i3/2251059038/O1CN0187rJ4M2GdSD1rS4ja_!!2251059038.png_q60.jpg""></p><p><strong>明星指挥 精湛演绎</strong></p><p>奥地利维也纳施特劳斯家族爱乐乐团的现任指挥——萨伯ATTILA SZABO，同时也是奥地利著名的小提琴大师，生于1941年，1962年他夺取了第一个国际小提琴大奖—巴托克音乐大奖;并在同年创办了著名的萨伯弦乐四重奏组,出版了数十张CD,在许多重要的艺术节上都留有他的足迹。萨伯教授长期任教于奥地利凯腾州立音乐学院，不仅是桃李满天下的音乐教育家，更是世界著名小提琴收藏家。萨伯拥有数十把意大利名琴，他不仅演奏古典作品,还演奏过250多个新作品。他的演奏风范,不禁使人们联想到施特劳斯的圆舞曲《维也纳人的气质》。其中他最偏爱也是最常使用的一把意大利名琴是制于1686年名为斯特拉迪瓦里的古琴，其价值超过两百万美金。</p><p><img src=""//img.alicdn.com/imgextra/i1/2251059038/O1CN01NGqyLe2GdSD0WwM7s_!!2251059038.png_q60.jpg""></p><p><strong>中西合璧 纯臻体验</strong></p><p>此次新年音乐会的中国巡演，奥地利维也纳斯特劳斯家族爱乐乐团非常重视中国的音乐文化传统，带来了许多中国特色的曲目《我的祖国》、《春节序曲》，充分迎合中国新年的喜乐氛围。同时他们也将纯正的国外交响序曲带到观众面前，其专业的演奏和音乐交流，时而激情时而浪漫，时刻让在场的观众接受来自听觉和心灵的至高洗礼。在2019-2020跨年之际，与家人携手享受当下，共同迎接美好新年。</p><p><img src=""//img.alicdn.com/imgextra/i1/2251059038/O1CN01xQbpks2GdSD21ygxs_!!2251059038.png_q60.jpg""></p><p><strong>媒体报道 盛赞洗礼</strong></p><p>2018年12月27日，上海贺渌汀音乐厅全场爆满，维也纳圆舞曲的酣畅旋律恣意流淌，观众一次又一次起立鼓掌……在不可复制的爆棚中，所有人无一例外的收获了巨大的快乐！这是“青岛啤酒金奖之夜——奥地利维也纳施特劳斯家族爱乐乐团新年音乐会”的演出现场。奥地利维也纳施特劳斯家族爱乐乐团倾情演绎百年经典，呈现了一场世界级的音乐鉴赏。这也是北京爱乐继央视少儿频道“银河之声”新年交响乐节目之后的又一年度巨献。</p><p><strong>——网易文化频道</strong></p><p>奥地利维也纳施特劳斯家族爱乐乐团2017年新年音乐会观后感</p><p>这是一次迟到很久的音乐会。</p><p>音乐、食物、绘画——或者说艺术，这三样是没有语言以及国界障碍的交流渠道。美食慰藉人的心灵，而音乐，慰藉人的灵魂。</p><p><strong>——豆瓣文化话题</strong></p><p><strong><img src=""//img.alicdn.com/imgextra/i1/2251059038/O1CN01270Va52GdSCyQKj1T_!!2251059038.png_q60.jpg""></strong></p><ol><li>Giacchino Rossini ： William Tell Overtures 3’40’’&nbsp;</li></ol><p>罗西尼：威廉退尔序曲</p><ol><li>Josef Strauss ： Dorfschwalben aus Österreich Walzer&nbsp;&nbsp;&nbsp;&nbsp; 164&nbsp;&nbsp;&nbsp; 8’12’’</li></ol><p>&nbsp; 约瑟夫•施特劳斯：奥地利的村雁</p><ol><li>Johann Strauss ： Vernugungszug Polka Quickly&nbsp; 132&nbsp; &nbsp;&nbsp; 2’40’’</li></ol><p>&nbsp; 约翰•施特劳斯：愉快列车波尔卡</p><ol><li>Émile Waldteufel - The skaters Waltzer 183&nbsp;&nbsp;&nbsp; 6’50’’</li></ol><p>&nbsp; 埃米尔•瓦尔德特费尔：溜冰圆舞曲</p><ol><li>v. Beethoven ：Romanze for Solo Violin und Orchestra in F-Dur 9’40’’</li></ol><p>&nbsp; 贝多芬：F大调浪漫曲</p><ol><li>Chinese Piece ：My Motherland 3’30’’</li></ol><p>&nbsp; 中国作品：我的祖国</p><ol><li>Strauss Sohn ：Furioso Polka Op.260&nbsp; &nbsp;2’37’’</li></ol><p>&nbsp; 约翰•施特劳斯：激情波尔卡</p><p><strong>Pause </strong><strong>中场休息</strong></p><ol><li>Chinese Piece ：Spring Festival Overture 5’00’’</li></ol><p>&nbsp;中国作品：春节序曲&nbsp;&nbsp; 作曲：李焕之</p><ol><li>Giacchino Rossini ：Il Barbiere di Siviglia Overture 7’37’’</li></ol><p>罗西尼：塞维利亚的理发师序曲</p><ol><li>Jacob Gade ：Tango Jalousie 4’20’’</li></ol><p>雅克布•盖得：嫉妒探戈</p><ol><li>Strauss II ：Vergnugungszug polka schnell 2’44’’</li></ol><p>小约翰•施特劳斯：游览列车快速波尔卡</p><ol><li>Vittorio Monti ：Csardasch 5’00’’</li></ol><p>&nbsp; 蒙蒂：查尔达斯</p><ol><li>Johann Strauss ：Éljen a Magyar Hungarian Pollka Quickly Op.332 2’30’’</li></ol><p>&nbsp; 约翰•施特劳斯：匈牙利万岁波尔卡</p><ol><li>Johann Strauss ：An der schönen blauen Donau Walzer 314 &nbsp;&nbsp;&nbsp; 9’30’’</li></ol><p>&nbsp; 约翰•施特劳斯：蓝色多瑙河</p><p><strong>返场曲目：</strong></p><p>Good news from Beijing</p><p>北京喜讯传边寨</p><p>Radetzky Marsch</p><p>拉德斯基进行曲&nbsp;</p><p><em>以上曲目以现场演奏为准</em></p><p><em><img src=""//img.alicdn.com/imgextra/i3/2251059038/O1CN01CXFe5r2GdSCzH31wV_!!2251059038.png_q60.jpg""></em></p></p></div></div> <div class=""list"" id=""notice0""><div class=""title"">购票须知</div> <div class=""words""><div><p class=""item_title"">我最多可以购买几张？</p> <ul><li>本项目每个场次每笔订单最多购买6张；如超出该数量，您可以分多单购买</li></ul></div><div><p class=""item_title"">我购买后是否可以退换票？</p> <ul><li>票品为有价证券，非普通商品，其背后承载的文化服务具有时效性、稀缺性等特征，不支持退换。如您购票后无法正常观看，还请自行处理</li></ul></div><div><p class=""item_title"">我如何入场？</p> <ul><li>本项目提供纸质票，当天请务必携带收到的纸质门票，验票后入场（仅提供订单或订单截图无效）</li></ul></div><div><p class=""item_title"">儿童购票</p> <ul><li>儿童一律凭票入场</li></ul></div><div><p class=""item_title"">我要怎么开发票？</p> <ul><li>如需发票，请您在演出开始前通过订单页补开，发票将在演出结束后1个月左右，统一由开具方提供</li></ul></div><div><p class=""item_title"">我的座位怎么安排？/现场入座要求是什么？</p> <ul><li>本项目支持选座购买。观演时请按照门票的座位信息对号入座</li></ul></div><div><p class=""item_title"">需要实名购买吗？</p> <ul><li>本项目无需实名制购票，购买时不需要选择观演人</li></ul></div><div><p class=""item_title"">异常行为说明</p> <ul><li>对于异常订购行为，大麦网有权在订单成立或者生效之后取消相应订单。异常订购行为包括但不限于以下情形：（1）通过同一ID订购超出限购张数的订单；（2）经合理判断认为非真实消费者的下单行为，包括但不限于通过批量相同或虚构的支付账号、收货地址（包括下单时填写及最终实际收货地址）、收件人、电话号码订购超出限购张数的订单</li></ul></div></div></div><div class=""list"" id=""notice1""><div class=""title"">观演须知</div> <div class=""words""><div><p class=""item_title"">演出时长</p> <ul><li>演出时长:约90分钟（以现场为准）</li></ul></div><div><p class=""item_title"">入场时间</p> <ul><li>请于开始前约30分钟入场</li></ul></div><div><p class=""item_title"">禁止携带物品</p> <ul><li>由于安保和版权的原因，大多数演出、展览及比赛场所禁止携带食品、饮料、专业摄录设备、打火机等物品，请您注意现场工作人员和广播的提示，予以配合</li></ul></div><div><p class=""item_title"">寄存说明</p> <ul><li>有寄存处,入场口右侧</li></ul></div></div></div></div>"
