name,activable,startdate,enddate,phone,location,x,y,cate,description
法国巴黎爱乐乐团2020蓉欧新年音乐会,在售中,2019.12.27 周五 19:30,,,ICON.云端 天府音乐厅,104.069916,30.536836,0,演出介绍：法国巴黎爱乐乐团2020蓉欧新年音乐会「乐团历史」法国巴黎爱乐乐团于1725年成立于于巴黎L'Oise大区，其前身是一个名叫音乐会的管铉乐团。数百年来，该乐团更替过40位团长，和33位名指挥和50位首席小提琴家。巴黎爱乐乐团作为城市的一个响亮的名片，一直在法国以及欧洲各地巡演。在历史的长河中，该乐团为古典音乐的发扬光大做出了卓越的贡献。「乐团成就」法国著名大提琴演奏家皮埃尔福尔尼，竖琴演奏家莉莉拉斯克娜和凡尚丹迪尼，以及长笛演奏家坲洛里安古山均是该乐团的独奏演员。在平均每年进行的300多场演出中，乐团培养了一批又一批的年轻音乐家。同时也让观众见证了乐团的发展壮大。乐团在世界各地巡回演出的同时，每年夏季举办大提琴国际音乐节。来自世界各地的大提琴演奏家在音乐节期间举办各种专场音乐会和大师班。「乐团指挥」法国巴黎爱乐乐团的第33任指挥。1977年开始担任法国国家喜剧歌剧院交响乐团的指挥达15年之久。1980年通过严格的筛选，蒂埃里被任命于法国巴黎爱乐乐团的第33任指挥。他同时还兼任法国勒阿佛交响乐团的指挥。作为一个作曲家，蒂埃里创作了大量的交响乐和歌剧乐曲，比如歌剧：爱丽丝的幽魂，尼克勒的双足。他还为女高音，男高音和男中音，合唱团以及竖琴创作乐曲。他创作的乐曲已在众多国际音乐节中演唱，演奏。1957年出生在法国诺曼底大区的蒂埃里是一个敏感，幽默有严重洁癖的人。喜欢抽雪茄，擅长烹调。他的口头禅是：我只和酷爱音乐的人做朋友。「女高音」（歌唱家/教授）法国巴黎爱乐乐团女高音维尼克。曾经在法国著名的索邦大学担任艺术系系主任的要职，但为了自己钟爱的演唱事业毅然决然的放弃了这份工作，而进入法国巴黎爱乐乐团担任女高音独唱演员「男高音」（著名歌唱家/艺术家）多次被法国各歌剧院邀请担任古典歌剧的男主角。2018苒让编导的歌舞剧 ""明日她将再次欢笑 ""在法国取得了巨大的成功，该剧一直在法国巡回演出至今。2019年苒让在法国最优美的海滨城市"" 多维尔 ""举办了个人演唱会。「场馆介绍」成都ICON●云端天府音乐厅（成都市高新区天府大道中段1577号）位于成都高新南区南端，西临天府大道，南临南河，东、北临天府软件园。音乐厅内部空间设计结合了传统长方形和非对称布局的特点。观众席非对称排开、多面环绕着中央舞台，座椅错落摆放在不同水平面的平台上，仿佛置身蜿蜒起伏的云南梯田之间。作为纯自然声专业音乐厅，目前云端·天府音乐厅声场效果已接近国际A级标准。「曲目单」（曲目以演出当天为准）1er partie上半场：Auf der Jagd Polka Schnell                         Johann STAUSS在猎场上快速波尔卡                            约翰 施特劳斯Les Belles Américaines                           Jacques OFFENBACH美丽的美国圆舞曲                              雅克 奥芬巴赫Ouverture du printemps                          李焕之春节序曲Solo de violon "" Sch?n Rosmarin""                   Fritz KREISLER小提琴独奏"" 美丽的罗丝玛琳""                   佛里茨 克莱斯勒Ouverture de Carmen                            Georges BIZET卡门序曲                                      乔治 比才Solo de Soprano "" Habanera""                      Georges BIZET女高音独唱，歌剧卡门选曲                      乔治 比才"" 哈巴涅拉""Solo de Ténor  "" Votre Toast""                     Georges BIZET男高音独唱，歌剧卡门选曲                      乔治 比才"" 斗牛士之歌""Espana Volse                                   Emile WALDTEUFEL西班牙圆舞曲                                 埃米尔 瓦尔特费尔Concerto Fl?te "" Frantaisie Brillante Sur Carmen""      Fran?ois BORNE长笛协奏曲"" 卡门主题幻想曲""                   佛朗索瓦 博尔纳2ème Partie下半场：Unter Donner und Bliz Polka Schelle                 Johann STRAUSS电闪雷鸣波尔卡les voix du Printemps Valse chantée Avec Soprano     Johann STRAUSS春之声 女高音伴唱                             约翰 施特劳斯Duo de soprano et ténor"" Libiamo""                 Giuseppe VERDI男女声二重唱，歌剧茶花女选曲"" 祝酒歌""         朱赛佩 威尔第Solo de Ténor "" Nessum Dorma""                   Giacomo PUCCINI男高音独唱，歌剧图兰朵选曲"" 今夜无人入眠""     贾科莫 普契尼Duo de soprano et Ténor                         Francis LEMARQUE男女声二重唱"" 在巴黎""                        佛朗西斯科 勒马克Valse de l'Empereur                             Johann STRAUSS皇帝圆舞曲                                   约翰 施特劳斯Ouverture d'Orphée aux Enfers                    Jacques OFFENBACH地狱中的奥菲欧序曲                           雅克 奥芬巴赫演出在售中,2019年12月27日演出地点：成都ICON●云端天府音乐厅（成都市高新区天府大道中段1577号）票价：380、580、780、980、1280"
「影响城市之声音乐节」Glass Animal 专场,在售中,2019.12.01 周日 21:00,,,梵木创艺区·正火艺术中心1号馆,104.150516,30.622714,0,演出介绍：阵容Lineup：Glass Animals(UK)Glass Animals , 几个具有相似音乐趣味，而又无所事事的大学音乐怪才，往往会组成一支乐队，Glass Animals就是这样诞生的。在唱作者、制作人Dave Bayley的带领和牵线下，这支英国牛津乐队于2010年正式组建，随后，迷幻而又潮湿的单曲「Gooey」让人们见证了乐队的崛起，首张专辑「ZABA」和紧随其后两年多的巡演，则为他们打下了坚实可观的乐迷基础，第二张专辑发行之后，Glass Animals已经俨然是欧美独立乐坛的另类宠儿。Glass Animals可谓队如其名，他们在透彻、易碎的表面下潜藏着动物般的原始性，他们是合成器流行、独立、电子、嘻哈的迷人混合物，介于 alt,J 的怪异和 Rhye 的暧昧迷离，Glass Animals正在用他们极具部落感的节拍、细碎微妙的声响，创造出独属于自己的生动、醉人的声音世界。如果你觉得这些只是评论界的文字游戏，那么，登上过Coachella、Lollapalooza、Glastonbury等顶级音乐节的舞台，全球范围内多场演出售罄，在知名电视节目上亮相……这些则具有足够的说服力，来证明Glass Animals是一支绝对值得你去关注、聆听和在现场体验的乐队。"
潘洵——贝多芬钢琴奏鸣曲专场音乐会,在售中,2019.12.22,2019.12.23,,四川音乐学院大音乐厅,104.079991,30.639305,0,演出介绍：美国米勒斯维尔大学音乐学院钢琴教授，演奏博士。美国兰开斯特国际钢琴艺术节艺术总监。1986年，中国民族作品钢琴比赛中荣获一等奖； 1987年，智利第十四届“Dr.LuisSigall” 国际钢琴比赛中荣获大奖；1990年，代表中国参加朝鲜平壤第四届国际艺术节并获奖；1992年，美国第四届“FrinnaAwerbuch”国际钢琴大赛中获奖，并由此取得第一次在卡内基音乐厅演奏的机会；1994 年，在美国纽约举行的国际艺术家比赛(Artists International)，荣获首奖。美国权威音乐杂志Star Ledger的评述：“他（潘洵）用超凡的音乐和娴熟的技巧感动了观众。”潘洵自幼随祖母及父母(钢琴演奏家潘一鸣教授和应诗真教授)接受音乐启蒙教育， 1984年考入中国中央音乐学院，期间曾两次荣获中国第一个音乐奖学金,,,“沈心工奖学金”。后考入美国纽约雪城大学(Syracuse University) 继续深造，于1996年获美国罗格斯大学(Rutgus University) 钢琴演奏博士学位。曾先后师从于应诗真，潘一鸣，朱工一和提奥多∙列特文(Theodore Lettvin) 等国内外著名音乐教授。潘洵曾任美国宾夕法尼亚音乐学院钢琴系主任，还担任中央音乐学院，中国音乐学院，四川音乐学院，温州大学，山东大学，烟台大学，福州大学，贵州大学，青海师范大学，和中国西北民族大学等多所学校的客座教授，并在世界各地举办大师课及担任许多著名音乐节的教授，包括维也纳雷协悌兹基音乐大师班暨夏令营；美国华盛顿国际钢琴艺术节和“Vivace” 艺术节；意大利国际室内乐音乐节等；并受邀在2012年10月第七届北京国际钢琴艺术节的开幕音乐会上演奏。同时多次受邀在世界各地担任国际比赛的评委。由于潘洵近几年在国际音乐界的突出表现，“FrinnaAwerbuch”国际钢琴比赛组委会更邀请他担任自2006年以来的比赛的评委。     潘洵还是美国著名“纽斯德” 三重奏(Newstead Trio)和“克莱维诺”三重奏(Trio Clavino)的钢琴家，从事室内乐演奏，并与包括世界著名音乐大师 Arnold Steinhardt等在内的音乐家合作。“纽斯德” 三重奏迄今为止已经灌录了五张唱片，他们的最近一张CD获得美国音乐杂志Fanfare的极高评价。2014年和2016年，“克莱维诺”三重奏两次获得著名的美国国务院颁发的福布莱特基金奖并由美国驻华大使馆邀请在中国的多个城市和东盟音乐周举行巡演，获得轰动。   由于在音乐上的突出成就，潘洵自1997年起便入选英国剑桥大学的《国际音乐名人录》(International Who’s Who Directory) 和《国际传记字典》(Dictionary of International Biography)。        为庆祝2020年音乐巨匠贝多芬诞辰250周年，潘洵将用15场音乐会来演奏贝多芬的全部32首钢琴奏鸣曲、10首钢琴／小提琴奏鸣曲、5首钢琴／大提琴奏鸣曲及3首钢琴／大提琴变奏曲。"
【超燃音乐系】 燃系钢琴史诗交响电声音乐会《VICTORY》,在售中,2020.01.12 周日 19:30,,,成都艺术中心音乐厅(原特仑苏音乐厅),104.096728,30.648094,0,演出介绍：【超燃音乐系】燃系钢琴史诗交响电声音乐会《VICTORY》演出在售中,2020年1月12日  19:30演出地点：特仑苏音乐厅演出票价：100/180/280/380/480套票价格：780元  （480元×2 张），1180元（480元×3张）演出时长：100分钟,0,演出介绍：超燃音乐系－是针对爱好纯音乐的中青年观众创建的LIVE厂牌。超燃音乐系列演出都是燃系音乐或舞蹈。打造最酷的音乐现场。2020年1月12日。超燃音乐系演出之－燃系钢琴史诗交响电声新年音乐会《Victory》登陆成都特仑苏音乐厅！★100%热血音乐★交响乐团+电声乐团高清LED播放恢宏的混剪画面，带来视觉冲击力！一燃到底的曲目：Victory.《变形金刚》配乐Scorponok .《指环王》配乐Concerning Hobbits.《权力的游戏》主题音乐Main Title .《加勒比海盗》配乐He's a Pirate.Intro:The Dawn（亡灵序曲）《复仇者联盟》The Avengers ..VICTORY－史诗音乐代表火遍全球的音乐《Victory》，你真的了解它吗，它的背后是个传奇作为一首火遍全球的纯音乐，大多数人将其评价为史诗，它也的确配得上是史诗，它以恢弘的气势引人入胜，没有人唱却胜似有千万人在唱，风格大气壮观，雄浑有力又不失细腻，就算你单曲循环个几十遍，还是能感受到那汹涌澎湃的气势和势不可挡锐气，不愧为史诗。《Victory》的创作团队是Two Steps from Hell（又名两步逃离地狱或者地狱边缘）。其在2006年3月正式坐落于美国洛杉矶，是一家专门制作音乐的公司，由尼克菲尼克斯和托马斯 J柏格森两位共同创办，他们的音乐类型属于原创配乐。由于其公司吸收了很多人才，使得其音乐在世界范围内十分出名，《Victory》、《Star Sky》、《Empier Of Angels》等等都是相当出名的作品。我们将本首曲子做为主题，并且在现场混剪《霍比特人五军之战》。代表着本场音乐会的调性就是：激情，热血，酷燃！《权力的游戏》（Game of Thrones），是美国HBO电视网制作推出的一部中世纪史诗奇幻题材的电视剧。该剧改编自美国作家乔治·R·R·马丁的奇幻小说《冰与火之歌》系列。其中主题曲、插曲、片尾曲、背景音乐配乐里面的歌曲非常好听经典，作者是出生于1974年的德国资深音乐人Ramin Djawadi，他极为擅长电子音效合成，很多著名的影片都是他的作曲，如加勒比海盗的附加音乐等，他也给很多美剧做幕后配乐。加勒比海盗主题曲：he's a pirate是电影配乐大师克劳斯巴德尔特(Klaus Badelt)和电影配乐大师汉斯季末(Hans Zimmer)共同完成的作品，中文译名为:他是一个海盗。pirate为海盗的意思。该曲是十大气势背景音乐之一，许多电视节目中都用到过。总的来说，这是一首感人的、有气势的自由之歌，它将自由诠释的天衣无缝。题名“The Dawn”原意为黎明、拂晓、破晓，被魔兽玩家们称为“亡灵序曲”。这是因为游戏《魔兽世界》中，开头音乐的旋律与The Dawn相同；后来另一名网友以《The Dawn》作为背景音乐，用《魔兽争霸3》中亡灵族的过场画面，剪辑制作了一部MV，并命名为《亡灵序曲》。而且，金属音乐表达的就是沉迷于对死亡、黑暗和痛苦的情感，所以将其称为“亡灵序曲”再合适不过。至此，该曲的中文名就随着这部MV一传十十传百流传开来，而真实名字却不被广为人知。The Avengers是电影复仇者联盟3：无限战争的原声音乐。由美国电影配乐作曲家Alan Silvestri创作。《复仇者联盟3：无限战争》是由安东尼•罗素、乔•罗素执导，小罗伯特•唐尼、乔什•布洛林、克里斯•埃文斯、克里斯•海姆斯沃斯、斯嘉丽•约翰逊、马克•鲁法洛等主演的科幻片，是复仇者联盟系列电影的第三部，是漫威电影宇宙的第十九部电影，该片将与《雷神3：诸神黄昏》剧情连接，该片将于2018年4月27日在美国上映，2018年5月11日在中国大陆上映。该片讲述复仇者联盟和他们的超级英雄盟友们必须愿意牺牲一切，才能在灭霸毁灭宇宙之前将其击败   曲目单 LIST （以现场演出为准）（总长度100分钟左右）：1、《超人》主题曲                   2、Flight Of The Silver Bird——TSFH3、《珍珠港》配乐Tennessee4、《007》配乐5、《哈利波特》主题曲6、《环太平洋》 主题曲7、《指环王》主题曲8、《权力的游戏》 主题音乐9、Star Sky——TSFH10、Victory——TSFH11、《加勒比海盗》主题曲12、克罗地亚狂想曲13、Intro:The Dawn（亡灵序曲）14、变形金刚主题曲15、GO TIME16、Black Heart——TSFH17、《星球大战7原力觉醒》组曲18、《碟中谍》 主题曲19、《复仇者联盟》主题曲 20、Empire Of Angles——TSFH"
“成都城市音乐会”—中外经典歌剧之夜,在售中,2019.12.06 周五 19:30,,,阿尔法影城4楼阿尔法剧场,104.080077,30.659409,0,演出介绍：“成都城市音乐会”—中外经典歌剧之夜导演、声乐指导：周容生周容生：男中音，歌剧导演；现为四川音乐学院声乐系副教授。主要获奖情况及作品2013年赴俄罗斯圣彼得堡音乐学院获“俄罗斯圣彼得堡第六届利拉国际音乐比赛”一等奖。2013年获四川音乐学院首届青年教师教学比赛三等奖。2014年获第四届孔雀奖全国高等艺术院校声乐大赛银奖。曾多次前往美国、新西兰、俄罗斯、德国等地演出访问学习，参加了文化部主办的歌剧导演培训。曾在：《金沙》《狂雪》《天府古镇黄龙溪》《波西米亚人》《卓文君》等多部歌剧、音乐剧中参与制作和演出。并在学术刊物和核心刊物上著有学术专著和论文论文数十篇。艺术指导：肖诗乐肖诗乐，四川音乐学院声乐系钢琴艺术指导，四川省钢琴艺术指导协会理事，首届星海音乐学院钢琴艺术指导比赛全国优秀演奏奖，四川音乐学院优秀教师，多次担任国内外各种比赛的钢琴伴奏，参加各类大师课的艺术指导工作，常年活跃在各类音乐会舞台。《秘婚记》（Il matrimonio segreto）〔意〕作曲：多梅尼科·奇马罗萨(Cimarosa 1749,1801)演出阵容：卡罗莱纳 ：吴紫蓥饰埃利斯塔  ：刘好饰孔特,格拉夫 ：何毛毛饰菲达玛 ：易梓涵饰帕欧利诺 ：郑启荣饰杰罗尼莫 ：刘鑫达饰剧情简介：年轻的律师帕欧利诺和贵族小姐卡罗莱纳偷偷相爱并秘密结婚。律师帕欧利诺想通过促成自己朋友孔特,格拉夫伯爵和卡罗莱纳的姐姐埃利斯塔结婚的方式，让卡罗莱纳的父亲富商杰罗尼莫同意自己和卡罗莱纳的婚礼。但孔特,格拉夫伯爵却一眼看中了卡罗莱纳，当孔特,格拉夫伯爵向卡罗莱纳表达爱意时，姐姐埃利斯塔出现了，误会的同时并指责妹妹卡罗莱纳。卡罗莱纳有口难辩，于是卡罗莱纳请姑妈菲达玛来帮忙，希望菲达玛姑妈能安慰姐姐埃利斯塔，但菲达玛姑妈并没有解决卡罗莱纳和埃利斯塔两姐妹之间的误会。持续的争吵引来了父亲杰罗尼莫和律师帕欧利诺。大伙儿一起指责妹妹卡罗莱纳轻浮。卡罗莱纳有口难辩，混乱之中，大家各执己《兰花花》作曲：张千一（1959.9）演出阵容：兰花花：曾晓涵饰赶羊人：冯万饰骆驼子：刘炎杰饰剧情简介：“延安府临镇川谁不知道，蓝家河兰花花人材最好，俊脸蛋细身腰风摆柳条，白日思夜晚想睡不着觉。”她是蓝家河远近闻名的大美人，一十三省的人尖尖。年轻帅气的外乡人骆驼子与她一见钟情，私定终身。可是老天的戏弄，骆驼子被赶出蓝家河，而她却被父亲和周老爷逼迫嫁给卑微的赶羊人。新婚当夜，兰花花为了爱情，同命运的安排抗争，将已怀有骆驼子孩子的事实告诉了赶羊人，赶羊人一时不知所措，愤愤离开。独守空房的兰花花，回想起与骆驼子的美好往事…《阿伊达》（Aida)作曲：朱赛佩·威尔第（Giuseppe Verdi 1813,1901）〔意〕演出阵容：阿伊达/埃塞俄比亚公主：柳沁媛 饰拉达梅斯/埃及将军：冯万 饰阿摩纳斯洛/埃塞俄比亚国王：祁建松 饰（特邀）剧情简介：古埃及法老王时代，埃及和埃塞俄比亚战事又起，埃及将军拉达梅斯率部出征，迎战埃塞俄比亚国王阿摩纳斯洛，埃塞俄比亚战败，将军拉达梅斯却爱上了埃塞俄比亚公主阿伊达。 盛大的欢庆场面映衬着广场上武士们凯旋归来的喜悦。阿伊达却在被拉达梅斯所虏的囚犯中发现了伪装成士兵的父亲。败阵下来的埃塞俄比亚国王和公主一筹莫展，痛苦的拉达梅斯为阿伊达身处险境而焦虑，无意走漏了防守薄弱地区的秘密。为了自由的爱情，也为了避免两国的长期交恶，拉达梅斯将生死置之度外，毅然决定放走阿伊达父女。不料，阿伊达父女俩逃离的行动被发现，拉达梅斯被判决埋入墓穴，阿伊达为了爱情，来到墓穴，决心与拉达梅斯相伴生死…《波西米亚人》（Bohemia people）作曲：吉亚卡摩·普契尼（Giacomo Puccini 1858,1924）〔意〕演出阵容：咪咪 ：刘茜饰穆塞塔／歌手：董慕蓉饰鲁道夫／作家：温哥华饰萧纳尔／音乐家：晏竟凯饰马切洛／画家：魏源饰（特邀）柯林／哲学家：王梓壕饰（特邀）剧情简介：春天，拉丁区的公寓里，鲁道夫与马切洛想起自己已分手的女友，无心工作。不一会儿，萧纳尔与柯林带着美酒与佳肴回来，四个人嬉笑打闹起来。穆塞塔突然到访，她激动的说，咪咪病重，为了见情人最后一面而来，但体力不支，昏倒在楼下。鲁道夫冲出房门将咪咪抱了回来，鲁道夫握着咪咪的手，回忆他们初次见面时的情景，咪咪一时激动，晕过去，鲁道夫惊叫起来。片刻之后，萧纳尔惊慌的指出咪咪已经没有了呼吸。一时间，他们满面泪水，看着床上面容安详的咪咪，房间里一片哀凉。鲁道夫浑身颤抖，他摸索着来到咪咪的身边，紧紧抱着咪咪渐渐冰冷的身体，呼唤她的名字…指导单位：四川省文化和旅游厅社会组织联合党委主办单位：四川省文化院团联盟四川音乐会学院声乐系承办单位：四川登满演艺经纪有限公司演出单位：周容生副教授教学班演出地点：阿尔法剧场（中影阿尔法影城7号厅）演出在售中,2019年12月06日晚19:30"
